{
  "artifact_index_diagnostics": [
    {
      "actual_sha256": "6b94296575e6a02f8e9c13c13ef4506b9e6830081e047bef8bfad228b7187ced",
      "category": "hash_mismatch",
      "expected_sha256": "e037dc01fe3e263e941586567e6caa19d7ad130caf601109dc7c5892662fd076",
      "lane": "model-card-x-ray",
      "message": "model-card-x-ray: data/processed/wave2_fetch_report.json hash mismatch: expected e037dc01fe3e263e941586567e6caa19d7ad130caf601109dc7c5892662fd076, got 6b94296575e6a02f8e9c13c13ef4506b9e6830081e047bef8bfad228b7187ced",
      "path": "data/processed/wave2_fetch_report.json"
    },
    {
      "actual_sha256": "5790460fe73bc968e5b70ebe553eb7a423b6793aae74432ec7646afde3c8b68a",
      "category": "hash_mismatch",
      "expected_sha256": "95766431573ecb554ce93c463dbb39c9308531bdd33befe2291d5a72e41b8e1b",
      "lane": "model-card-x-ray",
      "message": "model-card-x-ray: data/processed/wave2_subset_summary.json hash mismatch: expected 95766431573ecb554ce93c463dbb39c9308531bdd33befe2291d5a72e41b8e1b, got 5790460fe73bc968e5b70ebe553eb7a423b6793aae74432ec7646afde3c8b68a",
      "path": "data/processed/wave2_subset_summary.json"
    },
    {
      "actual_sha256": "6bdf973942c24ba2abb30609f50a6eb6329e9a7a8a9c608528141dec3906a68e",
      "category": "hash_mismatch",
      "expected_sha256": "3c09bd00ba4da0d67a9174beacec9b2f74f96185ccdce5f78b2bb865b1dd0fec",
      "lane": "model-card-x-ray",
      "message": "model-card-x-ray: data/processed/wave2_verifications.jsonl hash mismatch: expected 3c09bd00ba4da0d67a9174beacec9b2f74f96185ccdce5f78b2bb865b1dd0fec, got 6bdf973942c24ba2abb30609f50a6eb6329e9a7a8a9c608528141dec3906a68e",
      "path": "data/processed/wave2_verifications.jsonl"
    },
    {
      "actual_sha256": "784be3d263e518866b48793f7b86a8b1f6d018659659f9bc4ca2b65726608d93",
      "category": "hash_mismatch",
      "expected_sha256": "e7fbdb73b78fb462b2ec711a3f6519bee1123f107b451cb8813ec5a4baad8a20",
      "lane": "model-card-x-ray",
      "message": "model-card-x-ray: pipeline/verify_claims.py hash mismatch: expected e7fbdb73b78fb462b2ec711a3f6519bee1123f107b451cb8813ec5a4baad8a20, got 784be3d263e518866b48793f7b86a8b1f6d018659659f9bc4ca2b65726608d93",
      "path": "pipeline/verify_claims.py"
    },
    {
      "actual_sha256": "c4745fbe17b83ec0c520b8cffbad08cda585d23cc7d56509a28a220ae5c3bb39",
      "category": "hash_mismatch",
      "expected_sha256": "d79549591ac2f4cef5fe159eb547c88aedda0007cded3d3d984fbafbce13aa8c",
      "lane": "model-card-x-ray",
      "message": "model-card-x-ray: tests/test_extract_claims.py hash mismatch: expected d79549591ac2f4cef5fe159eb547c88aedda0007cded3d3d984fbafbce13aa8c, got c4745fbe17b83ec0c520b8cffbad08cda585d23cc7d56509a28a220ae5c3bb39",
      "path": "tests/test_extract_claims.py"
    },
    {
      "actual_sha256": "2c16501e252357b741ea355a536493d1a190c86a22e9aca5b659bf765f71cb87",
      "category": "hash_mismatch",
      "expected_sha256": "f9189fa1a881232671e9885db2e290951915832c74b234168563aaef10f4a897",
      "lane": "model-card-x-ray",
      "message": "model-card-x-ray: tests/test_verify_claims.py hash mismatch: expected f9189fa1a881232671e9885db2e290951915832c74b234168563aaef10f4a897, got 2c16501e252357b741ea355a536493d1a190c86a22e9aca5b659bf765f71cb87",
      "path": "tests/test_verify_claims.py"
    },
    {
      "actual_sha256": "537720dc6e9463d9311a03dec742c598045504f4354f30a4ffa2cb23752974c7",
      "category": "stale_historical_hash_rows",
      "lane": "pki-atlas-trusted-lists",
      "message": "pki-atlas-trusted-lists: CLAIMS.md has 3 stale historical hash rows; current file matches 537720dc6e9463d9311a03dec742c598045504f4354f30a4ffa2cb23752974c7; stale expected: 1f1c3fa18584148027c0a362dd081fd263b4de7b2a1cce1ed0e0c7db16a8e7a9, 23006b29d47d2f92a8c447b30f2e56419fa69b7ea63daa87293858f5cdb7ceef, 5a61f0947edebece33e6d9444e901ac93880f00b61b1100a40ad168364c2e590",
      "path": "CLAIMS.md",
      "stale_sha256": [
        "1f1c3fa18584148027c0a362dd081fd263b4de7b2a1cce1ed0e0c7db16a8e7a9",
        "23006b29d47d2f92a8c447b30f2e56419fa69b7ea63daa87293858f5cdb7ceef",
        "5a61f0947edebece33e6d9444e901ac93880f00b61b1100a40ad168364c2e590"
      ]
    },
    {
      "actual_sha256": "ad5bc67bab4b10c48bc712fbc88e5938f1fe524ff20136bbad3ed14083bfbe47",
      "category": "stale_historical_hash_rows",
      "lane": "pki-atlas-trusted-lists",
      "message": "pki-atlas-trusted-lists: SOURCES.md has 3 stale historical hash rows; current file matches ad5bc67bab4b10c48bc712fbc88e5938f1fe524ff20136bbad3ed14083bfbe47; stale expected: 4bd5b4118d9121612136a2356ab7c5400ddae9eadf19bac93e0055bfe945b048, d392b7deeaf235f72b7100e2b5ec71270f2a9179d79d0205d7816b958401dafb, e3fe3d3e243e06e66050ca21b5e7b18c0bb14a6d184efcd9cf1509adc05f65d6",
      "path": "SOURCES.md",
      "stale_sha256": [
        "4bd5b4118d9121612136a2356ab7c5400ddae9eadf19bac93e0055bfe945b048",
        "d392b7deeaf235f72b7100e2b5ec71270f2a9179d79d0205d7816b958401dafb",
        "e3fe3d3e243e06e66050ca21b5e7b18c0bb14a6d184efcd9cf1509adc05f65d6"
      ]
    },
    {
      "actual_sha256": "5a6188924d25102a5f8e1a22a8ceb5d627045f3bca8f6d32823dba5c4c65bc4b",
      "category": "stale_historical_hash_rows",
      "lane": "pki-atlas-trusted-lists",
      "message": "pki-atlas-trusted-lists: chapter/50-tooling.md has 2 stale historical hash rows; current file matches 5a6188924d25102a5f8e1a22a8ceb5d627045f3bca8f6d32823dba5c4c65bc4b; stale expected: a0afd5b8ad6ea067a0601b9977205ccccc1b55c9e91e62051a22cf06b5335277, a28e67132e2acb4e45a2e0e5ac79f10e5c0858e06d51bdb37c75947e071a8405",
      "path": "chapter/50-tooling.md",
      "stale_sha256": [
        "a0afd5b8ad6ea067a0601b9977205ccccc1b55c9e91e62051a22cf06b5335277",
        "a28e67132e2acb4e45a2e0e5ac79f10e5c0858e06d51bdb37c75947e071a8405"
      ]
    },
    {
      "actual_sha256": "51005daa98fca376e7f04803379cc1038862c9ecb444c4db40af4a553edc1db9",
      "category": "stale_historical_hash_rows",
      "lane": "pki-atlas-trusted-lists",
      "message": "pki-atlas-trusted-lists: chapter/90-references.md has 2 stale historical hash rows; current file matches 51005daa98fca376e7f04803379cc1038862c9ecb444c4db40af4a553edc1db9; stale expected: 11d5e3c2dcf1eae7de62ff0a6a39b3b54b501517baf0941eb7070c48cb2e611e, 96e29c57ca764ec4332f1d5d907539dbf0dc09cce1665f9f2e6edde901d8f752",
      "path": "chapter/90-references.md",
      "stale_sha256": [
        "11d5e3c2dcf1eae7de62ff0a6a39b3b54b501517baf0941eb7070c48cb2e611e",
        "96e29c57ca764ec4332f1d5d907539dbf0dc09cce1665f9f2e6edde901d8f752"
      ]
    },
    {
      "actual_sha256": "38d26679a6a8adf4b135700c0baff043f9a4169656d079820582ad1261c2cb91",
      "category": "stale_historical_hash_rows",
      "lane": "pki-atlas-trusted-lists",
      "message": "pki-atlas-trusted-lists: snapshots/2026-05-19/reference-consistency-review-current.json has 1 stale historical hash row; current file matches 38d26679a6a8adf4b135700c0baff043f9a4169656d079820582ad1261c2cb91; stale expected: 8080ffc4897affa1e1a1850914d12ca93144570ce9d2ba738a185720d50d0912",
      "path": "snapshots/2026-05-19/reference-consistency-review-current.json",
      "stale_sha256": [
        "8080ffc4897affa1e1a1850914d12ca93144570ce9d2ba738a185720d50d0912"
      ]
    },
    {
      "actual_sha256": "74c896c4247e84bac6f7ae3de42ace9fd9fe083a61174383de1bc27dabb9b640",
      "category": "stale_historical_hash_rows",
      "lane": "pki-atlas-trusted-lists",
      "message": "pki-atlas-trusted-lists: snapshots/2026-05-19/snapshot-date-lineage-review.json has 1 stale historical hash row; current file matches 74c896c4247e84bac6f7ae3de42ace9fd9fe083a61174383de1bc27dabb9b640; stale expected: 6731ded7543e1d718c9a3ddd36c0a32408d513c7267879f9406ea02b59c8b200",
      "path": "snapshots/2026-05-19/snapshot-date-lineage-review.json",
      "stale_sha256": [
        "6731ded7543e1d718c9a3ddd36c0a32408d513c7267879f9406ea02b59c8b200"
      ]
    },
    {
      "actual_sha256": "8a6f88be38c292182daf2e38d8e4632fbb9687f229d6f4e7d46ef11c0cda0787",
      "category": "stale_historical_hash_rows",
      "lane": "pki-atlas-trusted-lists",
      "message": "pki-atlas-trusted-lists: snapshots/2026-05-19/tooling-command-example-check.json has 2 stale historical hash rows; current file matches 8a6f88be38c292182daf2e38d8e4632fbb9687f229d6f4e7d46ef11c0cda0787; stale expected: 523e626f9fa3ab466ede678c3e941968a4a58ac5f553a9bcb5632b4f36c447e2, 64f4d5122b6814ddbf1ac55ce2b437445809f35cd21df62df868c1b576245e72",
      "path": "snapshots/2026-05-19/tooling-command-example-check.json",
      "stale_sha256": [
        "523e626f9fa3ab466ede678c3e941968a4a58ac5f553a9bcb5632b4f36c447e2",
        "64f4d5122b6814ddbf1ac55ce2b437445809f35cd21df62df868c1b576245e72"
      ]
    }
  ],
  "artifact_index_errors": [
    "model-card-x-ray: data/processed/wave2_fetch_report.json hash mismatch: expected e037dc01fe3e263e941586567e6caa19d7ad130caf601109dc7c5892662fd076, got 6b94296575e6a02f8e9c13c13ef4506b9e6830081e047bef8bfad228b7187ced",
    "model-card-x-ray: data/processed/wave2_subset_summary.json hash mismatch: expected 95766431573ecb554ce93c463dbb39c9308531bdd33befe2291d5a72e41b8e1b, got 5790460fe73bc968e5b70ebe553eb7a423b6793aae74432ec7646afde3c8b68a",
    "model-card-x-ray: data/processed/wave2_verifications.jsonl hash mismatch: expected 3c09bd00ba4da0d67a9174beacec9b2f74f96185ccdce5f78b2bb865b1dd0fec, got 6bdf973942c24ba2abb30609f50a6eb6329e9a7a8a9c608528141dec3906a68e",
    "model-card-x-ray: pipeline/verify_claims.py hash mismatch: expected e7fbdb73b78fb462b2ec711a3f6519bee1123f107b451cb8813ec5a4baad8a20, got 784be3d263e518866b48793f7b86a8b1f6d018659659f9bc4ca2b65726608d93",
    "model-card-x-ray: tests/test_extract_claims.py hash mismatch: expected d79549591ac2f4cef5fe159eb547c88aedda0007cded3d3d984fbafbce13aa8c, got c4745fbe17b83ec0c520b8cffbad08cda585d23cc7d56509a28a220ae5c3bb39",